{
  "$schema": "./evidence/schemas/toolchain-v1.schema.json",
  "schemaVersion": "toolchain-v1",
  "platform": {
    "os": "windows",
    "architecture": "x64",
    "nodeRange": ">=24.0.0"
  },
  "installRecipe": {
    "script": "scripts/install-p3-tool.ps1",
    "toolSelector": "-ToolId <exact-id>",
    "destinationPolicy": "-DestinationRoot <run-owned-path-outside-repository>",
    "globalInstall": false,
    "pathLookup": false
  },
  "reviewPolicy": {
    "reviewedAt": "2026-07-31",
    "expiresAt": "2026-09-30",
    "owner": "wotjr1649",
    "reviewer": "wotjr1649",
    "driftTriggers": [
      "node-24-security-release",
      "vendor-signing-key-change",
      "artifact-or-checksum-replacement",
      "relevant-tool-vulnerability",
      "license-or-source-identity-change",
      "action-runtime-change"
    ]
  },
  "tools": [
    {
      "id": "node",
      "version": "24.18.1",
      "purpose": "exact P3 JavaScript runtime",
      "owner": "wotjr1649",
      "installable": true,
      "artifact": {
        "kind": "zip",
        "url": "https://nodejs.org/dist/v24.18.1/node-v24.18.1-win-x64.zip",
        "sha256": "ec56b84a7551893ab2324ebdfdc4ab974a63b4781162600b68a1293cc3e53765",
        "executableRelativePath": "node-v24.18.1-win-x64/node.exe",
        "executableSha256": "ac51903c4c111815d52280b1fdcc8da067cbb37e2fe1a765097b85c3292c8582",
        "installedExecutableName": "node.exe"
      },
      "signature": {
        "kind": "gpg-checksums",
        "published": true,
        "verified": false,
        "signer": "DD792F5973C6DE52C432CBDAC77ABFA00DDBF2B7",
        "authenticodeRequired": false
      },
      "source": {
        "releaseUrl": "https://nodejs.org/en/blog/release/v24.18.1",
        "tag": "v24.18.1",
        "commit": "9623d9ad85d37d2f0610ec4a82b48182cf2c6061",
        "releasedAt": "2026-07-29",
        "license": "MIT",
        "licenseUrl": "https://github.com/nodejs/node/blob/9623d9ad85d37d2f0610ec4a82b48182cf2c6061/LICENSE"
      },
      "review": {
        "reviewedAt": "2026-07-31",
        "expiresAt": "2026-09-30",
        "disposition": "accepted"
      }
    },
    {
      "id": "npm",
      "version": "11.16.0",
      "purpose": "npm bundled in the exact Node.js archive",
      "owner": "wotjr1649",
      "installable": false,
      "artifact": {
        "kind": "embedded",
        "url": "https://nodejs.org/dist/v24.18.1/node-v24.18.1-win-x64.zip",
        "sha256": "ec56b84a7551893ab2324ebdfdc4ab974a63b4781162600b68a1293cc3e53765",
        "executableRelativePath": "node-v24.18.1-win-x64/node_modules/npm/bin/npm-cli.js",
        "executableSha256": null,
        "installedExecutableName": null
      },
      "signature": {
        "kind": "inherited-node-archive",
        "published": true,
        "verified": false,
        "signer": "DD792F5973C6DE52C432CBDAC77ABFA00DDBF2B7",
        "authenticodeRequired": false
      },
      "source": {
        "releaseUrl": "https://github.com/npm/cli/releases/tag/v11.16.0",
        "tag": "v11.16.0",
        "commit": "960135ad6e26b2b656e23848690c9cfe3cb3783b",
        "releasedAt": "2026-05-27",
        "license": "Artistic-2.0",
        "licenseUrl": "https://github.com/npm/cli/blob/960135ad6e26b2b656e23848690c9cfe3cb3783b/LICENSE"
      },
      "review": {
        "reviewedAt": "2026-07-31",
        "expiresAt": "2026-09-30",
        "disposition": "accepted-bundled-only"
      }
    },
    {
      "id": "codex-regression-only",
      "version": "0.146.0",
      "purpose": "P2 build regression only; not P4 admission evidence",
      "owner": "wotjr1649",
      "installable": true,
      "artifact": {
        "kind": "file",
        "url": "https://releases.openai.com/codex/releases/0.146.0/codex-x86_64-pc-windows-msvc.exe",
        "sha256": "bc343ba420dc2e2e9f59e6fc5e5bf0aae1cd8c771fc319665241fc9c0271fddb",
        "executableRelativePath": "codex-x86_64-pc-windows-msvc.exe",
        "executableSha256": "bc343ba420dc2e2e9f59e6fc5e5bf0aae1cd8c771fc319665241fc9c0271fddb",
        "installedExecutableName": "codex.exe"
      },
      "signature": {
        "kind": "authenticode",
        "published": true,
        "verified": true,
        "signer": "OpenAI OpCo, LLC",
        "authenticodeRequired": true,
        "authenticodeSubject": "CN=\"OpenAI OpCo, LLC\", O=\"OpenAI OpCo, LLC\", L=San Francisco, S=California, C=US",
        "authenticodeThumbprint": "0B7C30C11BF7250EC1ECD3254AC781D9E13D62F8"
      },
      "source": {
        "releaseUrl": "https://github.com/openai/codex/releases/tag/rust-v0.146.0",
        "tag": "rust-v0.146.0",
        "commit": "e363b08c9175ac1cbe5893615dd2cb9ddf95043b",
        "releasedAt": "2026-07-29",
        "license": "Apache-2.0",
        "licenseUrl": "https://github.com/openai/codex/blob/e363b08c9175ac1cbe5893615dd2cb9ddf95043b/LICENSE"
      },
      "review": {
        "reviewedAt": "2026-07-31",
        "expiresAt": "2026-09-30",
        "disposition": "accepted-regression-only"
      }
    },
    {
      "id": "claude-minimum",
      "version": "2.1.196",
      "purpose": "project-selected minimum for plugin validation compatibility",
      "owner": "wotjr1649",
      "installable": true,
      "artifact": {
        "kind": "file",
        "url": "https://downloads.claude.ai/claude-code-releases/2.1.196/win32-x64/claude.exe",
        "sha256": "180d7b279455e8b89d4353a5146447be2f80b80fb0db14bdc6dd9cb98c0aef09",
        "executableRelativePath": "claude.exe",
        "executableSha256": "180d7b279455e8b89d4353a5146447be2f80b80fb0db14bdc6dd9cb98c0aef09",
        "installedExecutableName": "claude.exe"
      },
      "signature": {
        "kind": "authenticode",
        "published": true,
        "verified": true,
        "signer": "Anthropic, PBC",
        "authenticodeRequired": true,
        "authenticodeSubject": "CN=\"Anthropic, PBC\", O=\"Anthropic, PBC\", L=San Francisco, S=California, C=US, SERIALNUMBER=4860621, OID.2.5.4.15=Private Organization, OID.1.3.6.1.4.1.311.60.2.1.2=Delaware, OID.1.3.6.1.4.1.311.60.2.1.3=US",
        "authenticodeThumbprint": "0D7581D2C51C59DF686C3000C70BF543F9F6C6CB"
      },
      "source": {
        "releaseUrl": "https://github.com/anthropics/claude-code/releases/tag/v2.1.196",
        "manifestUrl": "https://downloads.claude.ai/claude-code-releases/2.1.196/manifest.json",
        "tag": "v2.1.196",
        "commit": "c80896ca84bd5f45cfe2cd4c1ae91b5d4ba4280b",
        "buildCommit": "a4ca500badcac68511fb5f04303e32e4360f3dfb",
        "buildDate": "2026-06-29T01:55:28Z",
        "releasedAt": "2026-06-29",
        "license": "Commercial Terms",
        "licenseUrl": "https://github.com/anthropics/claude-code/blob/c80896ca84bd5f45cfe2cd4c1ae91b5d4ba4280b/LICENSE.md"
      },
      "review": {
        "reviewedAt": "2026-07-31",
        "expiresAt": "2026-09-30",
        "disposition": "accepted-project-minimum"
      }
    },
    {
      "id": "claude-current",
      "version": "2.1.220",
      "purpose": "current Claude Code compatibility snapshot",
      "owner": "wotjr1649",
      "installable": true,
      "artifact": {
        "kind": "file",
        "url": "https://downloads.claude.ai/claude-code-releases/2.1.220/win32-x64/claude.exe",
        "sha256": "af5bf1f1b2aadffc768eccd787084c6fdf9ba81624cbe96c1c6d9ac1a1550231",
        "executableRelativePath": "claude.exe",
        "executableSha256": "af5bf1f1b2aadffc768eccd787084c6fdf9ba81624cbe96c1c6d9ac1a1550231",
        "installedExecutableName": "claude.exe"
      },
      "signature": {
        "kind": "authenticode",
        "published": true,
        "verified": true,
        "signer": "Anthropic, PBC",
        "authenticodeRequired": true,
        "authenticodeSubject": "CN=\"Anthropic, PBC\", O=\"Anthropic, PBC\", L=San Francisco, S=California, C=US, SERIALNUMBER=4860621, OID.2.5.4.15=Private Organization, OID.1.3.6.1.4.1.311.60.2.1.2=Delaware, OID.1.3.6.1.4.1.311.60.2.1.3=US",
        "authenticodeThumbprint": "0D7581D2C51C59DF686C3000C70BF543F9F6C6CB"
      },
      "source": {
        "releaseUrl": "https://github.com/anthropics/claude-code/releases/tag/v2.1.220",
        "manifestUrl": "https://downloads.claude.ai/claude-code-releases/2.1.220/manifest.json",
        "tag": "v2.1.220",
        "commit": "7ef6eec9d9ba84ea6f233f26c45f1df5c5991843",
        "buildCommit": "4073f59596e272f39393db4f96abc5f4b10eff21",
        "buildDate": "2026-07-24T22:28:51Z",
        "releasedAt": "2026-07-25",
        "license": "Commercial Terms",
        "licenseUrl": "https://github.com/anthropics/claude-code/blob/7ef6eec9d9ba84ea6f233f26c45f1df5c5991843/LICENSE.md"
      },
      "review": {
        "reviewedAt": "2026-07-31",
        "expiresAt": "2026-09-30",
        "disposition": "accepted-current-snapshot"
      }
    },
    {
      "id": "actionlint",
      "version": "1.7.12",
      "purpose": "GitHub Actions syntax and semantic lint",
      "owner": "wotjr1649",
      "installable": true,
      "artifact": {
        "kind": "zip",
        "url": "https://github.com/rhysd/actionlint/releases/download/v1.7.12/actionlint_1.7.12_windows_amd64.zip",
        "sha256": "6e7241b51e6817ea6a047693d8e6fed13b31819c9a0dd6c5a726e1592d22f6e9",
        "executableRelativePath": "actionlint.exe",
        "executableSha256": "54ca21be3de4c7cfa26914aa8b61bd76bf573ef3caac5f80d110558cdf241718",
        "installedExecutableName": "actionlint.exe"
      },
      "signature": {
        "kind": "none",
        "published": false,
        "verified": false,
        "signer": null,
        "authenticodeRequired": false
      },
      "source": {
        "releaseUrl": "https://github.com/rhysd/actionlint/releases/tag/v1.7.12",
        "tag": "v1.7.12",
        "commit": "914e7df21a07ef503a81201c76d2b11c789d3fca",
        "releasedAt": "2026-03-30",
        "license": "MIT",
        "licenseUrl": "https://github.com/rhysd/actionlint/blob/914e7df21a07ef503a81201c76d2b11c789d3fca/LICENSE.txt"
      },
      "review": {